{
  "documentType": "clover-handoff-branch-capsule",
  "schemaVersion": "0.1.0",
  "capsuleId": "cell-capsule:clover-warroom:20260820",
  "recordedAt": "2026-08-20T21:19:42.000Z",
  "project": {
    "projectId": "clover-warroom",
    "title": "Clover WarRoom",
    "kind": "application",
    "portfolioArea": "legal-private",
    "purpose": "Provide an owner-controlled evidence and decision workspace while keeping private case material outside public Core."
  },
  "privacy": {
    "sensitivity": "private-sensitive",
    "containsRawCellData": false,
    "containsSecretValues": false,
    "containsPersonalData": false,
    "publicCapsuleSafe": true,
    "boundarySummary": "No legal evidence, communications, deadlines, identities, documents, or case content are present; this capsule carries only minimized project state."
  },
  "identities": {
    "live": {
      "status": "unknown",
      "repository": null,
      "branch": null,
      "commit": null,
      "tree": null,
      "version": null,
      "deploymentId": null,
      "url": null,
      "observedAt": null,
      "sourceRef": "portfolio/registry/projects.json#clover-warroom",
      "confidence": "unknown"
    },
    "current": {
      "status": "unknown",
      "repository": null,
      "branch": null,
      "commit": null,
      "tree": null,
      "version": null,
      "deploymentId": null,
      "url": null,
      "observedAt": null,
      "sourceRef": "portfolio/registry/projects.json#clover-warroom",
      "confidence": "unknown"
    },
    "candidate": {
      "status": "unknown",
      "repository": null,
      "branch": null,
      "commit": null,
      "tree": null,
      "version": null,
      "deploymentId": null,
      "url": null,
      "observedAt": null,
      "sourceRef": "portfolio/registry/projects.json#clover-warroom",
      "confidence": "unknown"
    }
  },
  "links": {
    "repository": null,
    "publicUrl": null,
    "sources": [
      { "kind": "registry", "ref": "portfolio/registry/projects.json#clover-warroom", "status": "verified" }
    ]
  },
  "verification": {
    "asOf": "2026-08-20T21:19:42.000Z",
    "freshness": "stale",
    "checkedSources": ["core-registry"],
    "unavailableSources": ["canonical-repository-identity", "canonical-deployment-identity"]
  },
  "health": {
    "state": "blocked",
    "blockers": [
      "Canonical repository, branch, source commit, deployment, and rollback identities are not verified.",
      "Any future runtime must prove a private-data boundary before private material is connected."
    ],
    "unknowns": [
      "Whether a distinct WarRoom repository or deployment currently exists.",
      "Whether any prior receipt has been accepted by the owner."
    ]
  },
  "relationships": {
    "dependencies": [
      { "projectId": "clover-core", "relationship": "Uses governance, authority, and receipt contracts without moving private evidence into Core.", "status": "proposed" },
      { "projectId": "knowledge-hub-window-vault", "relationship": "May reference permitted evidence pointers while source material remains access-controlled.", "status": "proposed" }
    ],
    "dependents": []
  },
  "latestAcceptedReceipt": {
    "status": "unknown",
    "receiptId": null,
    "receiptHash": null,
    "sourceRef": null
  },
  "activeOwnerDecision": {
    "status": "active",
    "decisionId": "decision:warroom-public-identity-readback-only",
    "summary": "The first handoff is proposed and unapproved; it may reconcile only public identity and sanitized receipt metadata and must not access private case material.",
    "sourceRef": "CLOVER_HANDOFF_LEDGER.md"
  },
  "recommendedNextAction": {
    "actionId": "CLOVER-2026-08-20-002",
    "summary": "After exact owner approval, reconcile public repository and deployment identities and return a sanitized source-bound receipt without reading private data.",
    "state": "owner-gated",
    "requiredApproval": "exact-owner-approval",
    "sourceBasis": "The registry names the project but supplies no canonical source or deployment identity."
  },
  "rollbackAnchors": [
    { "anchorType": "no-mutation", "identity": "No WarRoom state may change during identity reconciliation", "status": "verified", "sourceRef": "CLOVER_HANDOFF_LEDGER.md" }
  ],
  "capsuleHash": "37e2487a27143900e66cc69cd0bd8fe1ae44e4cf3fef5ad1d57a69636e0df97d"
}
