{"activeOwnerDecision":{"decisionId":null,"sourceRef":null,"status":"none-known","summary":"No Action 004 approval attestation exists."},"capsuleHash":"7c859ee6ad9330e7f42b78467236948280b1765e7c045b4d0dc17e4753d6e2d4","capsuleId":"cell-capsule:clover-launch-studio-private-owner:20260824","documentType":"clover-handoff-branch-capsule","health":{"blockers":["Application source absent.","Destination branch and worktree absent.","Providers, preview, private data and native voice absent.","Action 004 approval pending."],"state":"blocked","unknowns":["Future candidate commit, tree and provider resource identities."]},"identities":{"candidate":{"branch":null,"commit":null,"confidence":"unknown","deploymentId":null,"observedAt":null,"repository":null,"sourceRef":null,"status":"unknown","tree":null,"url":null,"version":null},"current":{"branch":"main","commit":"e5688c771d384d80a8c723cfa655298ce8257889","confidence":"high","deploymentId":null,"observedAt":"2026-08-24T16:55:00.000Z","repository":"chrisdortch/first","sourceRef":"github:chrisdortch/first#main@e5688c771d384d80a8c723cfa655298ce8257889","status":"verified","tree":"4c84129b4fb5ea098ac9d2325bc2cb387857a471","url":null,"version":"source-baseline-only"},"live":{"branch":null,"commit":null,"confidence":"unknown","deploymentId":null,"observedAt":null,"repository":null,"sourceRef":null,"status":"not-applicable","tree":null,"url":null,"version":null}},"latestAcceptedReceipt":{"receiptHash":null,"receiptId":null,"sourceRef":null,"status":"none-known"},"links":{"publicUrl":null,"repository":"chrisdortch/first","sources":[{"kind":"repository","ref":"github:chrisdortch/first#main@e5688c771d384d80a8c723cfa655298ce8257889","status":"verified"}]},"privacy":{"boundarySummary":"Public-safe proposal metadata only; no transcript, personal memory, credential, participant, private artifact or workspace data.","containsPersonalData":false,"containsRawCellData":false,"containsSecretValues":false,"publicCapsuleSafe":true,"sensitivity":"owner-internal"},"project":{"kind":"application","portfolioArea":"clover-core","projectId":"clover-launch-studio-private-owner","purpose":"Provide a future private owner Launch Session interface while every consequential effect remains delegated to Clover Handoff.","title":"Clover Launch Studio Private Owner App"},"recommendedNextAction":{"actionId":"CLOVER-2026-08-24-004","requiredApproval":"exact-owner-approval","sourceBasis":"Verified protected-main source baseline e5688c771d384d80a8c723cfa655298ce8257889; the application and destination do not yet exist.","state":"owner-gated","summary":"After exact owner approval, prepare one isolated local source candidate and stop before validation or publication."},"recordedAt":"2026-08-24T16:55:00.000Z","relationships":{"dependencies":[{"projectId":"clover-core","relationship":"Uses merged Launch Studio contracts and Handoff authority.","status":"verified"},{"projectId":"clover-context-gateway","relationship":"Retains a read-only context and review surface.","status":"verified"}],"dependents":[]},"rollbackAnchors":[{"anchorType":"git-commit","identity":"e5688c771d384d80a8c723cfa655298ce8257889","sourceRef":"github:chrisdortch/first#main","status":"verified"},{"anchorType":"no-mutation","identity":"no-application-or-provider-mutation-before-action-004","sourceRef":"owner-authorization-action-004","status":"verified"}],"schemaVersion":"0.1.0","verification":{"asOf":"2026-08-24T16:55:00.000Z","checkedSources":["github","local-canonical-checkout"],"freshness":"current","unavailableSources":[]}}
